{
  "schemaVersion": "1.0",
  "candidateId": "ARTIFACT-CANDIDATE-ARTIFACT-PLACEMENT-CONTRACT",
  "kind": "github-issue",
  "sourceRevision": "git:1d7b451fe8c6abbdae717975d686392ddd212c46",
  "intent": "문서성 산출물의 위치를 계약으로 일관되게 유지한다",
  "target": {
    "repository": "Woo-JongHo/world-wide-woo",
    "repositoryUrl": "https://github.com/Woo-JongHo/world-wide-woo",
    "defaultBranch": "main"
  },
  "content": {
    "issueType": "enhancement",
    "title": "산출물 위치 계약으로 문서를 docs에 일관되게 생성·보존한다",
    "statement": "리뷰·감사·연구 문서가 .www 숨김폴더에 일관 없이 생성돼 유실 위험이 있으므로, 위치 계약을 스킬·흐름에 정착시키고 잔여 파일을 정리해야 한다.",
    "details": [
      ".www/scratchpad에 리뷰 패킷·감사·연구 markdown 100여 건이 쌓였고 scratchpad는 gitignored라 유실된다.",
      "2026-09-18 문서 18건을 docs/audit·docs/research로 승격하고 검증 기록 2건을 .www/evidence로 옮겼으며 참조 5개 파일의 링크를 갱신했다.",
      "2026-09-18 AGENTS.md에 산출물 위치 섹션을 추가했지만 스킬별 산출 경로 준수 검증은 남아 있다.",
      "오류 출력만 남은 scratchpad 파일 4건은 삭제 승인 없이 유지되고 있다."
    ]
  },
  "links": {},
  "expectedBefore": {
    "repository": {
      "defaultBranch": "main",
      "nameWithOwner": "Woo-JongHo/world-wide-woo",
      "url": "https://github.com/Woo-JongHo/world-wide-woo"
    },
    "issueCount": 25,
    "issues": [
      {
        "number": 48,
        "state": "CLOSED",
        "title": "긴 세션의 작업 맥락을 요약해 같은 세션이나 새 세션에서 이어간다",
        "url": "https://github.com/Woo-JongHo/world-wide-woo/issues/48"
      },
      {
        "number": 37,
        "state": "CLOSED",
        "title": "결정 선택지가 없는 승인 오버레이가 대화를 중단한다",
        "url": "https://github.com/Woo-JongHo/world-wide-woo/issues/37"
      },
      {
        "number": 36,
        "state": "CLOSED",
        "title": "Session Review가 작업 결과 대신 원시 실행 기록을 나열한다",
        "url": "https://github.com/Woo-JongHo/world-wide-woo/issues/36"
      },
      {
        "number": 35,
        "state": "CLOSED",
        "title": "요청이 분석 시작 상태에 머물러 실행으로 전환되지 않는다",
        "url": "https://github.com/Woo-JongHo/world-wide-woo/issues/35"
      },
      {
        "number": 26,
        "state": "CLOSED",
        "title": "ID로 연결된 전체 개발 현황 Map을 제공한다",
        "url": "https://github.com/Woo-JongHo/world-wide-woo/issues/26"
      },
      {
        "number": 24,
        "state": "CLOSED",
        "title": "Native 구조화 결과에 Markdown과 의미 색상 하이라이트가 일관되게 적용되지 않는다",
        "url": "https://github.com/Woo-JongHo/world-wide-woo/issues/24"
      },
      {
        "number": 23,
        "state": "CLOSED",
        "title": "Native 실행 카드에서 긴 로컬 절대경로가 반복되어 핵심 결과를 읽기 어렵다",
        "url": "https://github.com/Woo-JongHo/world-wide-woo/issues/23"
      },
      {
        "number": 22,
        "state": "CLOSED",
        "title": "Chat이 구조화된 내부 응답 태그를 그대로 표시한다",
        "url": "https://github.com/Woo-JongHo/world-wide-woo/issues/22"
      },
      {
        "number": 21,
        "state": "CLOSED",
        "title": "재개한 Native 세션에서 복원된 Plan이 빈 Todo.md로 투영되지 않는다",
        "url": "https://github.com/Woo-JongHo/world-wide-woo/issues/21"
      },
      {
        "number": 20,
        "state": "CLOSED",
        "title": "저장되지 않은 T-note에도 Chat 완료 번호가 표시된다",
        "url": "https://github.com/Woo-JongHo/world-wide-woo/issues/20"
      },
      {
        "number": 19,
        "state": "CLOSED",
        "title": "오른쪽 상단 패널의 T-note와 Trace·Source 역할이 일관되지 않다",
        "url": "https://github.com/Woo-JongHo/world-wide-woo/issues/19"
      },
      {
        "number": 15,
        "state": "CLOSED",
        "title": "외부 변경의 실행 범위를 구조화된 승인 화면에서 확인한다",
        "url": "https://github.com/Woo-JongHo/world-wide-woo/issues/15"
      },
      {
        "number": 14,
        "state": "CLOSED",
        "title": "Bash 실행 카드 위에 현재 작업 설명이 표시되지 않는다",
        "url": "https://github.com/Woo-JongHo/world-wide-woo/issues/14"
      },
      {
        "number": 13,
        "state": "CLOSED",
        "title": "워크벤치의 연속 스크롤이 중간에 끊긴다",
        "url": "https://github.com/Woo-JongHo/world-wide-woo/issues/13"
      },
      {
        "number": 12,
        "state": "CLOSED",
        "title": "응답 갱신 중 입력창의 타이핑이 끊긴다",
        "url": "https://github.com/Woo-JongHo/world-wide-woo/issues/12"
      },
      {
        "number": 11,
        "state": "CLOSED",
        "title": "MCP 연결과 도구 구성을 Workbench에서 관리한다",
        "url": "https://github.com/Woo-JongHo/world-wide-woo/issues/11"
      },
      {
        "number": 10,
        "state": "CLOSED",
        "title": "같은 프로젝트에서 Workbench를 여러 개 열 수 없다",
        "url": "https://github.com/Woo-JongHo/world-wide-woo/issues/10"
      },
      {
        "number": 9,
        "state": "CLOSED",
        "title": "승인 대기 상태가 계속 작업 중인 것처럼 보인다",
        "url": "https://github.com/Woo-JongHo/world-wide-woo/issues/9"
      },
      {
        "number": 8,
        "state": "CLOSED",
        "title": "Native subagent의 모델 배치와 작업 상태를 한 흐름에서 관찰한다",
        "url": "https://github.com/Woo-JongHo/world-wide-woo/issues/8"
      },
      {
        "number": 7,
        "state": "CLOSED",
        "title": "첫 응답이 표시되기까지 지나치게 오래 걸린다",
        "url": "https://github.com/Woo-JongHo/world-wide-woo/issues/7"
      },
      {
        "number": 6,
        "state": "CLOSED",
        "title": "T-notes가 작업 중에도 실시간 진행 상태를 표시한다",
        "url": "https://github.com/Woo-JongHo/world-wide-woo/issues/6"
      },
      {
        "number": 5,
        "state": "CLOSED",
        "title": "Step 카드의 반복 라벨을 제거한다",
        "url": "https://github.com/Woo-JongHo/world-wide-woo/issues/5"
      },
      {
        "number": 4,
        "state": "CLOSED",
        "title": "프로젝트 대시보드와 모니터링 화면을 분리한다",
        "url": "https://github.com/Woo-JongHo/world-wide-woo/issues/4"
      },
      {
        "number": 2,
        "state": "CLOSED",
        "title": "WES Context Composer 경계를 WWW에 연결한다",
        "url": "https://github.com/Woo-JongHo/world-wide-woo/issues/2"
      },
      {
        "number": 1,
        "state": "CLOSED",
        "title": "Todo 세부 작업과 실시간 동작 설명을 추가한다",
        "url": "https://github.com/Woo-JongHo/world-wide-woo/issues/1"
      }
    ]
  },
  "validation": [
    {
      "id": "github-issue-search",
      "status": "pass",
      "evidence": "gh issue list --state all로 전체 25건의 제목을 확인했고 산출물 위치 계약과 같은 문제의 Issue를 찾지 못했다."
    },
    {
      "id": "source-inspection",
      "status": "pass",
      "evidence": "2026-09-18 scratchpad markdown 파일을 전수 분류해 문서 18건을 docs/audit·docs/research로 승격하고 검증 기록 2건을 .www/evidence로 옮겼으며, 끊긴 참조가 없음을 grep으로 확인했다."
    }
  ],
  "candidateDigest": "795fbc060387d14a9318bb903f37088e4371b584f6069f4c43a63ab74f1585d1"
}
